{
  "$schema": "https://raw.githubusercontent.com/VTSTech/AgentKthx/main/schemas/v0.2/plugin.schema.json",
  "name": "duckduckgo",
  "version": "0.1.0",
  "description": "DuckDuckGo AI Chat (duck.ai) backend — keyless, anonymous, zero-cost frontier models (GPT-4o mini, o3-mini, Claude Haiku, Llama 3.3 70B, Mistral Small 3 24B) via the NON-OpenAI /duckchat/v1 protocol (x-vqd-4 token handshake, own SSE shape, no /models endpoint, no sampling params, tools stripped — ReAct only). The only cloud backend that subclasses BaseBackend directly instead of CloudBackend",
  "author": {
    "name": "VTSTech",
    "url": "https://www.vts-tech.org"
  },
  "license": "MIT",
  "extensions": {
    "org.vts-tech.agentkthx": {
      "display_name": "DuckDuckGo AI Chat Backend",
      "type": "backend",
      "entrypoint": "__init__",
      "depends": [],
      "optional_depends": [],
      "config": {
        "env_prefix": "DUCKDUCKGO",
        "defaults": {
          "DUCKDUCKGO_BASE_URL": "https://duckduckgo.com",
          "DUCKDUCKGO_USER_AGENT": "",
          "DUCKDUCKGO_DEFAULT_MODEL": "gpt-4o-mini"
        }
      },
      "provides": {
        "backends": {
          "duckduckgo": "duckduckgo.DuckDuckGoBackend",
          "ddg": "duckduckgo.DuckDuckGoBackend"
        },
        "cli_commands": [],
        "cli_flags": {
          "--backend": [
            "duckduckgo",
            "ddg"
          ]
        }
      },
      "compatibility": {
        "agentkthx": ">=0.7.29"
      }
    }
  }
}
