{
  "$schema": "https://raw.githubusercontent.com/VTSTech/AgentKthx/main/schemas/v0.2/plugin.schema.json",
  "name": "siliconflow",
  "version": "0.1.0",
  "description": "SiliconFlow API backend for the 79-model live catalog (DeepSeek, Qwen, GLM, Kimi, MiniMax, Hunyuan, Gemma, gpt-oss) via OpenAI Chat-Completions API at api.siliconflow.com — no free tier: every model bills (Qwen/Qwen3-8B is the cheapest known, input ≈$0.06/1M tokens, billing-verified R07.29)",
  "author": {
    "name": "VTSTech",
    "url": "https://www.vts-tech.org"
  },
  "license": "MIT",
  "extensions": {
    "org.vts-tech.agentkthx": {
      "display_name": "SiliconFlow Cloud Backend",
      "type": "backend",
      "entrypoint": "__init__",
      "depends": [],
      "optional_depends": [],
      "config": {
        "env_prefix": "SILICONFLOW",
        "defaults": {
          "SILICONFLOW_BASE_URL": "https://api.siliconflow.com/v1",
          "SILICONFLOW_API_KEY": "",
          "SILICONFLOW_DEFAULT_MODEL": "Qwen/Qwen3-8B",
          "SILICONFLOW_FREE_ONLY": "false"
        }
      },
      "provides": {
        "backends": {
          "siliconflow": "siliconflow.SiliconFlowBackend",
          "sf": "siliconflow.SiliconFlowBackend"
        },
        "cli_commands": [],
        "cli_flags": {
          "--backend": [
            "siliconflow",
            "sf"
          ]
        }
      },
      "compatibility": {
        "agentkthx": ">=0.7.28"
      }
    }
  }
}
